<!ELEMENT futbol (equipos)>
<!ELEMENT equipos (nombre, copas, jugadores, equipacion, partidos, estadio)>
<!ELEMENT nombre (#PCDATA)>
<!ELEMENT copas (#PCDATA)>
<!ELEMENT jugadores (pichichi)>
<!ELEMENT pichichi (nombrejugador, fechanacimiento, goles, tarjetas)>
<!ELEMENT nombrejugador (#PCDATA)>
<!ELEMENT fechanacimiento (#PCDATA)>
<!ELEMENT goles (#PCDATA)>
<!ELEMENT tarjetas (amarillas, rojas)>
<!ELEMENT amarillas (#PCDATA)>
<!ELEMENT rojas (#PCDATA)>
<!ELEMENT equipacion (primera, segunda)>
<!ELEMENT primera (#PCDATA)>
<!ELEMENT segunda (#PCDATA)>
<!ELEMENT partidos (jugados)>
<!ELEMENT jugados (ganados, perdidos, empatados)>
<!ELEMENT ganados (#PCDATA)>
<!ELEMENT perdidos (#PCDATA)>
<!ELEMENT empatados (#PCDATA)>
<!ELEMENT estadio (nombreestadio, capacidad)>
<!ELEMENT nombreestadio (#PCDATA)>
<!ELEMENT capacidad (#PCDATA)>