<?xml version="1.0"?>
<!DOCTYPE futbol SYSTEM "futbol.dtd">

<futbol>
    <vacio></vacio>
    <equipos>
        <nombre>Betis</nombre>
        <copas>0</copas>
        <jugadores>
            <pichichi>
                <nombrejugador>Joaquin</nombrejugador>
                <fechanacimiento>1980-10-10</fechanacimiento>
                <goles>100</goles>
                <tarjetas>
                    <amarillas>1</amarillas>
                    <rojas>0</rojas>
                </tarjetas>
            </pichichi>
        </jugadores>
        <equipacion>
            <primera>Blanca y verde</primera>
            <segunda>Azul y blanca</segunda>
        </equipacion>
        <partidos>
            <jugados>
                <ganados>100</ganados>
                <perdidos>10</perdidos>
                <empatados>0</empatados>
            </jugados>
        </partidos>
        <estadio>
            <nombreestadio>Benito Villamar√≠n</nombreestadio>
            <capacidad>60000</capacidad>
        </estadio>
    </equipos>
</futbol>
